{
  "name": "km2_reference",
  "description": "Эталонный вариант: двухцепная ВЛ 220 кВ АС 300/39 + 2×ТРДН-40000/220",
  "variant": {
    "type": "A",
    "U_nom": 220,
    "wire": { "name": "АС 300/39", "R0": 0.096, "d_mm": 24, "D_m": 8 },
    "L": 82,
    "n_line": 2,
    "transformer": {
      "name": "ТРДН-40000/220",
      "n": 2,
      "dPk_kW": 170,
      "uk_pct": 11.5,
      "dPx_kW": 50,
      "Ix_pct": 0.9,
      "Uvn": 230,
      "Unn": 11,
      "Sn": 40
    },
    "S_start": { "P": 42, "tgphi": 0.484 },
    "U_end": 218
  },
  "tolerance_pct": 1,
  "expected": {
    "params": {
      "lg_ratio": 2.824,
      "x0": 0.424,
      "b0": 2.684e-6,
      "R_line": 3.94,
      "X_line": 17.38,
      "B_half": 220e-6,
      "R_T": 2.81,
      "X_T": 76.04,
      "dP_x_total": 0.1,
      "dQ_x_total": 0.72,
      "Q1": 20.33
    },
    "iterations": [
      { "Qc1": 10.65, "dS_line": { "P": 0.22, "Q": 0.98 }, "Qc2": 10.65, "dS_T": { "P": 0.19, "Q": 5.23 }, "S2": { "P": 41.49, "Q": 34.7 }, "U2": 231.1, "U1": 234.1 },
      { "Qc1": 12.06, "dS_line": { "P": 0.2, "Q": 0.89 }, "Qc2": 11.75, "dS_T": { "P": 0.19, "Q": 5.05 }, "S2": { "P": 41.51, "Q": 37.48 }, "U2": 232.0, "U1": 235.1 },
      { "Qc1": 12.17, "dS_line": { "P": 0.2, "Q": 0.89 }, "Qc2": 11.85, "dS_T": { "P": 0.19, "Q": 5.04 }, "S2": { "P": 41.51, "Q": 37.7 }, "U2": 232.1, "U1": 235.2 }
    ],
    "result": {
      "U1": 235.2,
      "U2": 232.1,
      "S2": { "P": 41.5, "Q": 37.7 },
      "U_nn": 10.43,
      "loss_total_P": 0.49,
      "loss_total_pct": 1.2
    }
  }
}
